{
  "classification": "COMMERCIAL_PRODUCTION_CANDIDATE_NOT_IMPORTED",
  "version": "commercial-input-v1.17b",
  "accounts": [
    {
      "accountId": "lila-molino-cafe-lila-taqueria",
      "legalName": "pending_verification",
      "displayName": "Lila Molino + Cafe / Lila Taqueria",
      "accountType": "Mexican kitchen brand",
      "emirate": "Dubai",
      "city": "Dubai",
      "channel": "HORECA and B2C",
      "contactStatus": "pending_verification",
      "commercialStatus": "pending_verification",
      "owner": "pending_verification",
      "priority": "A+",
      "paymentTerms": "pending_verification",
      "deliveryTerms": "pending_verification",
      "notes": "Founder-attested pipeline candidate; no contact or activation authorized.",
      "source": "docs/data/supplygraph-authorized-sellers/lila-molino-cafe-lila-taqueria.json",
      "evidenceSource": "docs/data/supplygraph-authorized-sellers/lila-molino-cafe-lila-taqueria.json",
      "evidenceDate": "2026-07-13T18:52:56.148Z",
      "verificationStatus": "founder_attested",
      "updatedAt": "2026-07-13T18:52:56.148Z"
    },
    {
      "accountId": "la-tiendita-abu-dhabi",
      "legalName": "pending_verification",
      "displayName": "La Tiendita",
      "accountType": "specialized Latin grocery",
      "emirate": "Abu Dhabi",
      "city": "Abu Dhabi",
      "channel": "B2C, small HORECA and corporate",
      "contactStatus": "pending_verification",
      "commercialStatus": "pending_verification",
      "owner": "pending_verification",
      "priority": "A+",
      "paymentTerms": "pending_verification",
      "deliveryTerms": "pending_verification",
      "notes": "Founder-attested pipeline candidate; no contact or activation authorized.",
      "source": "docs/data/supplygraph-authorized-sellers/la-tiendita-abu-dhabi.json",
      "evidenceSource": "docs/data/supplygraph-authorized-sellers/la-tiendita-abu-dhabi.json",
      "evidenceDate": "2026-07-13T18:52:58.321Z",
      "verificationStatus": "founder_attested",
      "updatedAt": "2026-07-13T18:52:58.321Z"
    },
    {
      "accountId": "maria-bonita-taco-shop-grill",
      "legalName": "pending_verification",
      "displayName": "Maria Bonita Taco Shop & Grill",
      "accountType": "Mexican restaurant",
      "emirate": "Dubai",
      "city": "Dubai",
      "channel": "B2C and boutique HORECA",
      "contactStatus": "pending_verification",
      "commercialStatus": "pending_verification",
      "owner": "pending_verification",
      "priority": "A",
      "paymentTerms": "pending_verification",
      "deliveryTerms": "pending_verification",
      "notes": "Founder-attested pipeline candidate; no contact or activation authorized.",
      "source": "docs/data/supplygraph-authorized-sellers/maria-bonita-taco-shop-grill.json",
      "evidenceSource": "docs/data/supplygraph-authorized-sellers/maria-bonita-taco-shop-grill.json",
      "evidenceDate": "2026-07-13T18:52:59.335Z",
      "verificationStatus": "founder_attested",
      "updatedAt": "2026-07-13T18:52:59.335Z"
    },
    {
      "accountId": "maiz-tacos-dubai",
      "legalName": "pending_verification",
      "displayName": "Maiz Tacos",
      "accountType": "taqueria and local brand",
      "emirate": "Dubai",
      "city": "Dubai",
      "channel": "B2C and HORECA",
      "contactStatus": "pending_verification",
      "commercialStatus": "pending_verification",
      "owner": "pending_verification",
      "priority": "A",
      "paymentTerms": "pending_verification",
      "deliveryTerms": "pending_verification",
      "notes": "Founder-attested pipeline candidate; no contact or activation authorized.",
      "source": "docs/data/supplygraph-authorized-sellers/maiz-tacos-dubai.json",
      "evidenceSource": "docs/data/supplygraph-authorized-sellers/maiz-tacos-dubai.json",
      "evidenceDate": "2026-07-13T18:53:00.518Z",
      "verificationStatus": "founder_attested",
      "updatedAt": "2026-07-13T18:53:00.518Z"
    },
    {
      "accountId": "el-mostacho-dubai",
      "legalName": "pending_verification",
      "displayName": "El Mostacho",
      "accountType": "independent Mexican restaurant",
      "emirate": "Dubai",
      "city": "Dubai",
      "channel": "B2C and small restaurants",
      "contactStatus": "pending_verification",
      "commercialStatus": "pending_verification",
      "owner": "pending_verification",
      "priority": "A",
      "paymentTerms": "pending_verification",
      "deliveryTerms": "pending_verification",
      "notes": "Founder-attested pipeline candidate; no contact or activation authorized.",
      "source": "docs/data/supplygraph-authorized-sellers/el-mostacho-dubai.json",
      "evidenceSource": "docs/data/supplygraph-authorized-sellers/el-mostacho-dubai.json",
      "evidenceDate": "2026-07-13T18:53:01.548Z",
      "verificationStatus": "founder_attested",
      "updatedAt": "2026-07-13T18:53:01.548Z"
    },
    {
      "accountId": "freshontable",
      "legalName": "pending_verification",
      "displayName": "FreshOnTable",
      "accountType": "farm-to-table platform",
      "emirate": "pending_verification",
      "city": "pending_verification",
      "channel": "HORECA",
      "contactStatus": "pending_verification",
      "commercialStatus": "pending_verification",
      "owner": "pending_verification",
      "priority": "A",
      "paymentTerms": "pending_verification",
      "deliveryTerms": "pending_verification",
      "notes": "Founder-attested pipeline candidate; UAE location needs account-level verification.",
      "source": "docs/data/supplygraph-authorized-sellers/freshontable.json",
      "evidenceSource": "docs/data/supplygraph-authorized-sellers/freshontable.json",
      "evidenceDate": "2026-07-13T18:53:02.901Z",
      "verificationStatus": "founder_attested",
      "updatedAt": "2026-07-13T18:53:02.901Z"
    },
    {
      "accountId": "greenheart-organic-farms",
      "legalName": "pending_verification",
      "displayName": "Greenheart Organic Farms",
      "accountType": "local agricultural producer",
      "emirate": "pending_verification",
      "city": "pending_verification",
      "channel": "HORECA and B2C",
      "contactStatus": "pending_verification",
      "commercialStatus": "pending_verification",
      "owner": "pending_verification",
      "priority": "A",
      "paymentTerms": "pending_verification",
      "deliveryTerms": "pending_verification",
      "notes": "Founder-attested pipeline candidate; Sharjah/Dubai location needs account-level verification.",
      "source": "docs/data/supplygraph-authorized-sellers/greenheart-organic-farms.json",
      "evidenceSource": "docs/data/supplygraph-authorized-sellers/greenheart-organic-farms.json",
      "evidenceDate": "2026-07-13T18:53:07.275Z",
      "verificationStatus": "founder_attested",
      "updatedAt": "2026-07-13T18:53:07.275Z"
    },
    {
      "accountId": "emirates-bio-farm",
      "legalName": "pending_verification",
      "displayName": "Emirates Bio Farm",
      "accountType": "organic farm and ecommerce",
      "emirate": "Abu Dhabi",
      "city": "Abu Dhabi",
      "channel": "HORECA and B2C",
      "contactStatus": "pending_verification",
      "commercialStatus": "pending_verification",
      "owner": "pending_verification",
      "priority": "A",
      "paymentTerms": "pending_verification",
      "deliveryTerms": "pending_verification",
      "notes": "Founder-attested pipeline candidate; no contact or activation authorized.",
      "source": "docs/data/supplygraph-authorized-sellers/emirates-bio-farm.json",
      "evidenceSource": "docs/data/supplygraph-authorized-sellers/emirates-bio-farm.json",
      "evidenceDate": "2026-07-13T18:53:08.601Z",
      "verificationStatus": "founder_attested",
      "updatedAt": "2026-07-13T18:53:08.601Z"
    },
    {
      "accountId": "taqado-mexican-kitchen",
      "legalName": "pending_verification",
      "displayName": "Taqado Mexican Kitchen",
      "accountType": "Mexican QSR chain",
      "emirate": "Dubai",
      "city": "Dubai",
      "channel": "offices, catering and B2C",
      "contactStatus": "pending_verification",
      "commercialStatus": "pending_verification",
      "owner": "pending_verification",
      "priority": "A",
      "paymentTerms": "pending_verification",
      "deliveryTerms": "pending_verification",
      "notes": "Founder-attested pipeline candidate; official source unavailable at observation time.",
      "source": "docs/data/supplygraph-authorized-sellers/taqado-mexican-kitchen.json",
      "evidenceSource": "docs/data/supplygraph-authorized-sellers/taqado-mexican-kitchen.json",
      "evidenceDate": "2026-07-13T18:53:09.610Z",
      "verificationStatus": "founder_attested",
      "updatedAt": "2026-07-13T18:53:09.610Z"
    },
    {
      "accountId": "burro-blanco-dubai",
      "legalName": "pending_verification",
      "displayName": "Burro Blanco",
      "accountType": "casual Mexican restaurant",
      "emirate": "Dubai",
      "city": "Dubai",
      "channel": "offices, B2C and catering",
      "contactStatus": "pending_verification",
      "commercialStatus": "pending_verification",
      "owner": "pending_verification",
      "priority": "A",
      "paymentTerms": "pending_verification",
      "deliveryTerms": "pending_verification",
      "notes": "Founder-attested pipeline candidate; no contact or activation authorized.",
      "source": "docs/data/supplygraph-authorized-sellers/burro-blanco-dubai.json",
      "evidenceSource": "docs/data/supplygraph-authorized-sellers/burro-blanco-dubai.json",
      "evidenceDate": "2026-07-13T18:53:12.309Z",
      "verificationStatus": "founder_attested",
      "updatedAt": "2026-07-13T18:53:12.309Z"
    }
  ],
  "skus": [
    {
      "skuId": "CMX-JAPANESE-STYLE-PEANUTS-WITH-VALENTINA-SAUCE-30G",
      "name": "Japanese Style Peanuts With Valentina Sauce 30g",
      "brand": "unknown",
      "category": "snacks",
      "supplier": "Intermex UAE",